{
  "$schema": "https://json-schema.org/draft/2020-12/schema",
  "$id": "https://optiontrader/contracts/candidate_trade_plan.json",
  "title": "CandidateTradePlan",
  "description": "Deterministic candidate trade plan. Must target exactly one broker_id. Never auto-submitted without Rust Final Risk Check.",
  "type": "object",
  "$defs": {
    "leg": {
      "type": "object",
      "properties": {
        "side": { "$ref": "common.json#/$defs/orderSide" },
        "type": { "$ref": "common.json#/$defs/optionRight" },
        "contract_id": { "type": "string", "minLength": 1 },
        "expiry": { "type": "string", "format": "date" },
        "strike": { "$ref": "common.json#/$defs/decimal" },
        "quantity": { "type": "integer", "minimum": 1 },
        "quote": { "$ref": "#/$defs/quoteProof" },
        "broker_contract_id": { "type": "string", "minLength": 1 },
        "symbol": { "type": "string", "minLength": 1 },
        "exchange": { "type": "string", "minLength": 1 }
      },
      "required": ["side", "type", "contract_id", "expiry", "strike", "quantity", "quote", "broker_contract_id", "symbol"],
      "additionalProperties": false
    },
    "quoteProof": {
      "type": "object",
      "properties": {
        "bid": { "$ref": "common.json#/$defs/decimal" },
        "ask": { "$ref": "common.json#/$defs/decimal" },
        "bid_size": { "type": "integer", "minimum": 1 },
        "ask_size": { "type": "integer", "minimum": 1 },
        "occurred_at_utc": { "$ref": "common.json#/$defs/utcTimestamp" },
        "delta": { "$ref": "common.json#/$defs/decimal" },
        "gamma": { "$ref": "common.json#/$defs/decimal" },
        "theta": { "$ref": "common.json#/$defs/decimal" },
        "vega": { "$ref": "common.json#/$defs/decimal" },
        "chain_snapshot_id": { "type": "string", "minLength": 1 },
        "provider": { "type": "string", "const": "THETADATA" }
      },
      "required": ["bid", "ask", "bid_size", "ask_size", "occurred_at_utc", "delta", "gamma", "theta", "vega", "chain_snapshot_id", "provider"],
      "additionalProperties": false
    },
    "adaptiveLimit": {
      "type": "object",
      "properties": {
        "initial_aggressiveness_bps": { "type": "integer", "minimum": 0, "maximum": 10000 },
        "max_attempts": { "type": "integer", "minimum": 1, "maximum": 10 },
        "max_quote_age_ms": { "type": "integer", "minimum": 1, "maximum": 5000 },
        "max_spread_bps": { "type": "integer", "minimum": 1, "maximum": 10000 }
      },
      "required": ["initial_aggressiveness_bps", "max_attempts", "max_quote_age_ms", "max_spread_bps"],
      "additionalProperties": false
    }
  },
  "properties": {
    "schema_version": { "type": "string", "const": "1.3" },
    "plan_id": { "type": "string" },
    "plan_hash": { "type": "string", "pattern": "^[a-f0-9]{64}$" },
    "idempotency_key": { "type": "string" },
    "session_id": { "type": "string" },
    "signal_id": { "type": "string" },
    "broker_id": { "$ref": "common.json#/$defs/brokerId" },
    "strategy": { "type": "string", "enum": ["LongGamma", "ShortPremium", "EventVolCrush"] },
    "execution_mode": { "$ref": "common.json#/$defs/executionMode" },
    "created_at_utc": { "$ref": "common.json#/$defs/utcTimestamp" },
    "legs": { "type": "array", "items": { "$ref": "#/$defs/leg" }, "minItems": 1, "maxItems": 4, "description": "One to four unique option legs. All leg quantities represent combo units and must be equal; cross-item equality is enforced by Pydantic and Rust." },
    "limit_price": { "$ref": "common.json#/$defs/decimal" },
    "max_slippage": { "$ref": "common.json#/$defs/decimal" },
    "max_loss": { "$ref": "common.json#/$defs/decimal" },
    "take_profit": { "$ref": "common.json#/$defs/decimal" },
    "stop_loss": { "$ref": "common.json#/$defs/decimal" },
    "time_stop_minutes": { "type": "integer", "minimum": 0 },
    "invalidation_rules": { "type": "array", "items": { "type": "string" } },
    "expires_at_utc": { "$ref": "common.json#/$defs/utcTimestamp" },
    "rule_version": { "type": "string" },
    "data_snapshot_ids": { "type": "array", "items": { "type": "string", "minLength": 1 }, "minItems": 1, "uniqueItems": true },
    "manual_confirmation_required": { "type": "boolean", "const": true }
    ,"order_side": { "$ref": "common.json#/$defs/orderSide" }
    ,"order_type": { "type": "string", "enum": ["MARKET", "LIMIT", "ADAPTIVE_LIMIT"] }
    ,"adaptive_limit": { "$ref": "#/$defs/adaptiveLimit" }
    ,"market_data_provider": { "type": "string", "const": "THETADATA" }
    ,"position_effect": { "type": "string", "enum": ["OPEN", "CLOSE"] }
  },
  "required": [
    "schema_version", "plan_id", "plan_hash", "idempotency_key", "session_id",
    "signal_id", "broker_id", "strategy", "execution_mode", "created_at_utc", "legs",
    "limit_price", "max_loss", "expires_at_utc", "rule_version", "data_snapshot_ids",
    "manual_confirmation_required", "order_side", "order_type", "market_data_provider",
    "position_effect"
  ],
  "allOf": [
    {
      "if": { "properties": { "order_type": { "const": "ADAPTIVE_LIMIT" } }, "required": ["order_type"] },
      "then": { "required": ["adaptive_limit"] },
      "else": { "not": { "required": ["adaptive_limit"] } }
    },
    {
      "if": { "properties": { "position_effect": { "const": "OPEN" } }, "required": ["position_effect"] },
      "then": { "properties": { "max_loss": { "pattern": "^(?!0+(\\.0+)?$)[0-9]+(\\.[0-9]+)?$" } } },
      "else": { "properties": { "max_loss": { "pattern": "^0+(\\.0+)?$" } } }
    },
    {
      "if": { "properties": { "order_type": { "const": "MARKET" } }, "required": ["order_type"] },
      "then": {
        "properties": {
          "position_effect": { "const": "CLOSE" },
          "legs": { "maxItems": 1 }
        }
      }
    }
  ],
  "additionalProperties": false
}
